{
  "id": "seafile",
  "stars": 15288,
  "last_commit": "2026-09-18T09:48:51Z",
  "latest_release": {
    "tag": "v9.0.5",
    "published_at": "2024-02-27T07:51:16Z",
    "url": "https://github.com/haiwen/seafile/releases/tag/v9.0.5"
  },
  "docker_pulls": null,
  "open_issues": 99,
  "fetched_at": "2026-09-30T03:38:44.426Z"
}
