{
  "id": "onlyoffice",
  "stars": 6964,
  "last_commit": "2026-07-22T09:43:52Z",
  "latest_release": {
    "tag": "v9.4.0",
    "published_at": "2026-05-19T08:55:22Z",
    "url": "https://github.com/ONLYOFFICE/DocumentServer/releases/tag/v9.4.0"
  },
  "docker_pulls": null,
  "open_issues": 1152,
  "fetched_at": "2026-10-03T03:45:21.721Z"
}
