{
  "id": "documenso",
  "stars": 15289,
  "last_commit": "2026-10-02T02:16:43Z",
  "latest_release": {
    "tag": "v2.19.0",
    "published_at": "2026-09-29T04:39:09Z",
    "url": "https://github.com/documenso/documenso/releases/tag/v2.19.0"
  },
  "docker_pulls": null,
  "open_issues": 203,
  "fetched_at": "2026-10-02T03:37:10.263Z"
}
