{
  "id": "grist",
  "stars": 11875,
  "last_commit": "2026-09-27T08:51:40Z",
  "latest_release": {
    "tag": "v1.7.19",
    "published_at": "2026-09-06T03:29:20Z",
    "url": "https://github.com/gristlabs/grist-core/releases/tag/v1.7.19"
  },
  "docker_pulls": null,
  "open_issues": 734,
  "fetched_at": "2026-09-28T03:42:09.822Z"
}
