{
  "id": "wg-easy",
  "stars": 27046,
  "last_commit": "2026-09-30T07:43:15Z",
  "latest_release": {
    "tag": "v15.4.0",
    "published_at": "2026-08-14T07:28:01Z",
    "url": "https://github.com/wg-easy/wg-easy/releases/tag/v15.4.0"
  },
  "docker_pulls": null,
  "open_issues": 47,
  "fetched_at": "2026-10-03T03:45:29.379Z"
}
