{
  "id": "wallabag",
  "stars": 12992,
  "last_commit": "2026-09-28T06:48:52Z",
  "latest_release": {
    "tag": "2.6.14",
    "published_at": "2025-10-07T08:06:17Z",
    "url": "https://github.com/wallabag/wallabag/releases/tag/2.6.14"
  },
  "docker_pulls": null,
  "open_issues": 768,
  "fetched_at": "2026-09-30T03:38:47.478Z"
}
