{
  "id": "kitchenowl",
  "stars": 3717,
  "last_commit": "2026-09-26T10:09:18Z",
  "latest_release": {
    "tag": "v0.7.10",
    "published_at": "2026-07-26T18:32:32Z",
    "url": "https://github.com/TomBursch/kitchenowl/releases/tag/v0.7.10"
  },
  "docker_pulls": null,
  "open_issues": 340,
  "fetched_at": "2026-10-01T03:42:47.031Z"
}
