{
  "id": "leantime",
  "stars": 11672,
  "last_commit": "2026-09-24T19:15:32Z",
  "latest_release": {
    "tag": "v3.10.0",
    "published_at": "2026-09-24T19:15:23Z",
    "url": "https://github.com/Leantime/leantime/releases/tag/v3.10.0"
  },
  "docker_pulls": null,
  "open_issues": 336,
  "fetched_at": "2026-09-28T03:42:13.168Z"
}
