{
  "id": "linkstack",
  "stars": 3888,
  "last_commit": "2026-07-21T12:40:17Z",
  "latest_release": {
    "tag": "v4.8.6",
    "published_at": "2026-02-17T16:53:47Z",
    "url": "https://github.com/LinkStackOrg/LinkStack/releases/tag/v4.8.6"
  },
  "docker_pulls": null,
  "open_issues": 52,
  "fetched_at": "2026-09-28T03:42:14.789Z"
}
