{
  "id": "kener",
  "stars": 5183,
  "last_commit": "2026-09-13T07:03:20Z",
  "latest_release": {
    "tag": "v4.1.5",
    "published_at": "2026-09-06T14:12:44Z",
    "url": "https://github.com/rajnandan1/kener/releases/tag/v4.1.5"
  },
  "docker_pulls": null,
  "open_issues": 72,
  "fetched_at": "2026-10-01T03:42:46.600Z"
}
