{
  "id": "prestashop",
  "stars": 9221,
  "last_commit": "2026-09-26T05:16:00Z",
  "latest_release": {
    "tag": "9.1.5",
    "published_at": "2026-08-18T08:23:25Z",
    "url": "https://github.com/PrestaShop/PrestaShop/releases/tag/9.1.5"
  },
  "docker_pulls": null,
  "open_issues": 2385,
  "fetched_at": "2026-09-27T03:37:15.303Z"
}
