{
  "id": "umami",
  "stars": 39033,
  "last_commit": "2026-09-26T22:28:01Z",
  "latest_release": {
    "tag": "v3.4.0",
    "published_at": "2026-09-17T04:21:49Z",
    "url": "https://github.com/umami-software/umami/releases/tag/v3.4.0"
  },
  "docker_pulls": null,
  "open_issues": 123,
  "fetched_at": "2026-09-27T03:37:18.159Z"
}
