{
  "id": "heyform",
  "stars": 8988,
  "last_commit": "2026-09-09T07:29:46Z",
  "latest_release": {
    "tag": "v3.0.3",
    "published_at": "2026-09-09T07:31:11Z",
    "url": "https://github.com/heyform/heyform/releases/tag/v3.0.3"
  },
  "docker_pulls": null,
  "open_issues": 12,
  "fetched_at": "2026-09-29T03:37:59.005Z"
}
