{
  "id": "fittrackee",
  "stars": 1169,
  "last_commit": "2026-09-26T09:50:59Z",
  "latest_release": {
    "tag": "v1.3.5",
    "published_at": "2026-09-09T19:04:51Z",
    "url": "https://github.com/SamR1/FitTrackee/releases/tag/v1.3.5"
  },
  "docker_pulls": null,
  "open_issues": 1,
  "fetched_at": "2026-10-03T03:45:11.505Z"
}
