{
  "id": "collabora",
  "stars": 3362,
  "last_commit": "2026-09-25T15:21:52Z",
  "latest_release": {
    "tag": "25.04.7-mobile",
    "published_at": "2025-12-05T16:41:36Z",
    "url": "https://github.com/CollaboraOnline/online/releases/tag/25.04.7-mobile"
  },
  "docker_pulls": null,
  "open_issues": 856,
  "fetched_at": "2026-10-03T03:45:08.053Z"
}
