{
  "id": "automatisch",
  "stars": 13981,
  "last_commit": "2026-02-11T19:53:04Z",
  "latest_release": {
    "tag": "v0.15.0",
    "published_at": "2025-08-08T13:07:43Z",
    "url": "https://github.com/automatisch/automatisch/releases/tag/v0.15.0"
  },
  "docker_pulls": null,
  "open_issues": 289,
  "fetched_at": "2026-09-29T03:37:51.128Z"
}
