{
  "id": "docuseal",
  "stars": 18648,
  "last_commit": "2026-09-28T11:59:14Z",
  "latest_release": {
    "tag": "3.3.0",
    "published_at": "2026-09-28T11:59:15Z",
    "url": "https://github.com/docusealco/docuseal/releases/tag/3.3.0"
  },
  "docker_pulls": null,
  "open_issues": 123,
  "fetched_at": "2026-10-03T03:45:09.502Z"
}
