{
  "id": "formbricks",
  "stars": 13022,
  "last_commit": "2026-09-26T11:19:45Z",
  "latest_release": {
    "tag": "6.0.0",
    "published_at": "2026-09-21T08:52:39Z",
    "url": "https://github.com/formbricks/formbricks/releases/tag/6.0.0"
  },
  "docker_pulls": null,
  "open_issues": 182,
  "fetched_at": "2026-09-27T03:37:05.256Z"
}
