{
  "id": "kimai",
  "stars": 5050,
  "last_commit": "2026-09-30T03:34:50Z",
  "latest_release": {
    "tag": "2.67.0",
    "published_at": "2026-09-13T20:40:29Z",
    "url": "https://github.com/kimai/kimai/releases/tag/2.67.0"
  },
  "docker_pulls": null,
  "open_issues": 349,
  "fetched_at": "2026-09-30T03:38:37.206Z"
}
